[
  {
    "id": "missile-launcher",
    "name": "Missile launcher",
    "type": "ranged",
    "profiles": [
      {
        "name": "Krak",
        "range": 48,
        "stats": {
          "A": 1,
          "S": 9,
          "AP": -2,
          "D": "D6",
          "BS": 3
        },
        "keywords": []
      },
      {
        "name": "Frag",
        "range": 48,
        "stats": {
          "A": "D6",
          "S": 4,
          "AP": 0,
          "D": 1,
          "BS": 3
        },
        "keywords": [
          {
            "keyword_id": "blast"
          }
        ]
      }
    ],
    "game_version": {
      "edition": "11th",
      "dataslate": "pre-launch-provisional"
    }
  },
  {
    "id": "multi-melta",
    "name": "Multi-melta",
    "type": "ranged",
    "profiles": [
      {
        "name": "Multi-melta",
        "range": 18,
        "stats": {
          "A": 2,
          "S": 9,
          "AP": -4,
          "D": "D6",
          "BS": 3
        },
        "keywords": [
          {
            "keyword_id": "melta",
            "parameters": {
              "value": 2
            }
          }
        ]
      }
    ],
    "game_version": {
      "edition": "11th",
      "dataslate": "pre-launch-provisional"
    }
  },
  {
    "id": "helbrute-plasma-cannon",
    "name": "Helbrute plasma cannon",
    "type": "ranged",
    "profiles": [
      {
        "name": "Helbrute plasma cannon",
        "range": 36,
        "stats": {
          "A": "D3",
          "S": 8,
          "AP": -3,
          "D": 3,
          "BS": 3
        },
        "keywords": [
          {
            "keyword_id": "blast"
          },
          {
            "keyword_id": "hazardous"
          }
        ]
      }
    ],
    "game_version": {
      "edition": "11th",
      "dataslate": "pre-launch-provisional"
    }
  },
  {
    "id": "twin-autocannon",
    "name": "Twin autocannon",
    "type": "ranged",
    "profiles": [
      {
        "name": "Twin autocannon",
        "range": 48,
        "stats": {
          "A": 2,
          "S": 9,
          "AP": -2,
          "D": 3,
          "BS": 3
        },
        "keywords": [
          {
            "keyword_id": "twin-linked"
          }
        ]
      }
    ],
    "game_version": {
      "edition": "11th",
      "dataslate": "pre-launch-provisional"
    }
  },
  {
    "id": "twin-inferno-heavy-bolter",
    "name": "Twin inferno heavy bolter",
    "type": "ranged",
    "profiles": [
      {
        "name": "Twin inferno heavy bolter",
        "range": 36,
        "stats": {
          "A": 3,
          "S": 5,
          "AP": -2,
          "D": 2,
          "BS": 3
        },
        "keywords": [
          {
            "keyword_id": "sustained-hits",
            "parameters": {
              "value": 1
            }
          },
          {
            "keyword_id": "twin-linked"
          }
        ]
      }
    ],
    "game_version": {
      "edition": "11th",
      "dataslate": "pre-launch-provisional"
    }
  },
  {
    "id": "twin-lascannon",
    "name": "Twin lascannon",
    "type": "ranged",
    "profiles": [
      {
        "name": "Twin lascannon",
        "range": 48,
        "stats": {
          "A": 1,
          "S": 12,
          "AP": -3,
          "D": "D6+1",
          "BS": 3
        },
        "keywords": [
          {
            "keyword_id": "twin-linked"
          }
        ]
      }
    ],
    "game_version": {
      "edition": "11th",
      "dataslate": "pre-launch-provisional"
    }
  },
  {
    "id": "inferno-combi-bolter",
    "name": "Inferno combi-bolter",
    "type": "ranged",
    "profiles": [
      {
        "name": "Inferno combi-bolter",
        "range": 24,
        "stats": {
          "A": 2,
          "S": 4,
          "AP": -2,
          "D": 1,
          "BS": 3
        },
        "keywords": [
          {
            "keyword_id": "rapid-fire",
            "parameters": {
              "value": 2
            }
          }
        ]
      }
    ],
    "game_version": {
      "edition": "11th",
      "dataslate": "pre-launch-provisional"
    }
  },
  {
    "id": "heavy-flamer",
    "name": "Heavy flamer",
    "type": "ranged",
    "profiles": [
      {
        "name": "Heavy flamer",
        "range": 12,
        "stats": {
          "A": "D6",
          "S": 5,
          "AP": -2,
          "D": 1,
          "BS": null
        },
        "keywords": [
          {
            "keyword_id": "ignores-cover"
          },
          {
            "keyword_id": "torrent"
          }
        ]
      }
    ],
    "game_version": {
      "edition": "11th",
      "dataslate": "pre-launch-provisional"
    }
  },
  {
    "id": "close-combat-weapon",
    "name": "Close combat weapon",
    "type": "melee",
    "profiles": [
      {
        "name": "Close combat weapon",
        "range": "Melee",
        "stats": {
          "A": 5,
          "S": 6,
          "AP": 0,
          "D": 1,
          "WS": 3
        },
        "keywords": []
      }
    ],
    "game_version": {
      "edition": "11th",
      "dataslate": "pre-launch-provisional"
    }
  },
  {
    "id": "helbrute-fist",
    "name": "Helbrute fist",
    "type": "melee",
    "profiles": [
      {
        "name": "Helbrute fist",
        "range": "Melee",
        "stats": {
          "A": 5,
          "S": 12,
          "AP": -2,
          "D": 3,
          "WS": 3
        },
        "keywords": []
      }
    ],
    "game_version": {
      "edition": "11th",
      "dataslate": "pre-launch-provisional"
    }
  },
  {
    "id": "helbrute-hammer",
    "name": "Helbrute hammer",
    "type": "melee",
    "profiles": [
      {
        "name": "Helbrute hammer",
        "range": "Melee",
        "stats": {
          "A": 5,
          "S": 14,
          "AP": -3,
          "D": "D6+1",
          "WS": 4
        },
        "keywords": []
      }
    ],
    "game_version": {
      "edition": "11th",
      "dataslate": "pre-launch-provisional"
    }
  },
  {
    "id": "power-scourge",
    "name": "Power scourge",
    "type": "melee",
    "profiles": [
      {
        "name": "Power scourge",
        "range": "Melee",
        "stats": {
          "A": 8,
          "S": 7,
          "AP": -1,
          "D": 2,
          "WS": 3
        },
        "keywords": []
      }
    ],
    "game_version": {
      "edition": "11th",
      "dataslate": "pre-launch-provisional"
    }
  },
  {
    "id": "warp-vortex",
    "name": "Warp vortex",
    "type": "ranged",
    "profiles": [
      {
        "name": "Torrent",
        "range": 18,
        "stats": {
          "A": "2D6",
          "S": 6,
          "AP": -1,
          "D": 1,
          "BS": null
        },
        "keywords": [
          {
            "keyword_id": "ignores-cover"
          },
          {
            "keyword_id": "torrent"
          }
        ]
      },
      {
        "name": "Blast",
        "range": 24,
        "stats": {
          "A": "D6+3",
          "S": 9,
          "AP": -2,
          "D": 2,
          "BS": 3
        },
        "keywords": [
          {
            "keyword_id": "blast"
          }
        ]
      },
      {
        "name": "Beam",
        "range": 36,
        "stats": {
          "A": 1,
          "S": 18,
          "AP": -3,
          "D": "D6+6",
          "BS": 3
        },
        "keywords": [
          {
            "keyword_id": "devastating-wounds"
          }
        ]
      }
    ],
    "game_version": {
      "edition": "11th",
      "dataslate": "pre-launch-provisional"
    }
  },
  {
    "id": "betentacled-maw",
    "name": "Betentacled maw",
    "type": "melee",
    "profiles": [
      {
        "name": "Betentacled maw",
        "range": "Melee",
        "stats": {
          "A": 15,
          "S": 7,
          "AP": 0,
          "D": 1,
          "WS": 3
        },
        "keywords": []
      }
    ],
    "game_version": {
      "edition": "11th",
      "dataslate": "pre-launch-provisional"
    }
  },
  {
    "id": "mutalith-claws",
    "name": "Mutalith claws",
    "type": "melee",
    "profiles": [
      {
        "name": "Mutalith claws",
        "range": "Melee",
        "stats": {
          "A": 5,
          "S": 10,
          "AP": -2,
          "D": 3,
          "WS": 3
        },
        "keywords": []
      }
    ],
    "game_version": {
      "edition": "11th",
      "dataslate": "pre-launch-provisional"
    }
  },
  {
    "id": "soulshatter-lascannon",
    "name": "Soulshatter lascannon",
    "type": "ranged",
    "profiles": [
      {
        "name": "Soulshatter lascannon",
        "range": 48,
        "stats": {
          "A": 2,
          "S": 12,
          "AP": -3,
          "D": "D6+1",
          "BS": 3
        },
        "keywords": []
      }
    ],
    "game_version": {
      "edition": "11th",
      "dataslate": "pre-launch-provisional"
    }
  },
  {
    "id": "inferno-combi-weapon",
    "name": "Inferno combi-weapon",
    "type": "ranged",
    "profiles": [
      {
        "name": "Inferno combi-weapon",
        "range": 24,
        "stats": {
          "A": 1,
          "S": 4,
          "AP": -2,
          "D": 1,
          "BS": 4
        },
        "keywords": [
          {
            "keyword_id": "anti",
            "parameters": {
              "target_keyword": "Infantry",
              "threshold": 4
            }
          },
          {
            "keyword_id": "devastating-wounds"
          },
          {
            "keyword_id": "rapid-fire",
            "parameters": {
              "value": 1
            }
          }
        ]
      }
    ],
    "game_version": {
      "edition": "11th",
      "dataslate": "pre-launch-provisional"
    }
  },
  {
    "id": "havoc-launcher",
    "name": "Havoc launcher",
    "type": "ranged",
    "profiles": [
      {
        "name": "Havoc launcher",
        "range": 48,
        "stats": {
          "A": "D6",
          "S": 5,
          "AP": 0,
          "D": 1,
          "BS": 3
        },